en;it;es;fr
;I nostri eroi hanno imparato diverse abilità, ma in battaglia potranno usare solo una di queste. L’abilità scelta può venire azionata premendo il tasto D durante il gioco, al costo di 5 ESP.;;
;Da ora potrai scegliere quale abilità preferisci utilizzare. Per selezionare quella desiderata, entra nel menu Oggetti e seleziona quella da assegnare alla pressione del tasto D. Le abilità disponibili sono:;;
;- Barriera, per creare una barriera che protegge dagli attacchi nemici§ - Gelo, per immobilizzare tutti i nemici presenti sul campo di battaglia;;
;- Furia, per incrementare la tua forza d'attacco e sconfiggere i nemici in un colpo solo§ Assegna le abilità dal menu e poi utilizzale in battaglia richiamandole con il tasto D.;;
;Puoi assegnare i tuoi oggetti curativi ai tasti numerici 1 e 2, per una scelta rapida in gioco. Per assegnare un oggetto premi il tasto (o 1 o 2) sopra l'oggetto che vuoi assegnare a quel tasto.;;
;In questo modo il tuo oggetto verrà assegnato al tasto premuto.§ Una volta assegnato l'oggetto, per utilizzarlo rapidamente in gioco ti basterà premere il tasto a cui è stato assegnato.;;
;Ricorda che solo gli oggetti curativi possono essere assegnati a questi tasti, come carne e pozioni.§ Premi Esc per accedere al menu degli oggetti.;;
;;;
;Per aprire o chiudere il menu premi il tasto Esc. Nel menu troverai:§ - Missioni, in cui vedere tutte le tue missioni e quella in corso§ - Oggetti, per vedere od utilizzare i vari oggetti trovati nell’avventura;;
;- Potenzia, dove, grazie agli ESP ottenuti, potrai potenziare i tuoi eroi, le loro armi e apprendere nuove abilità utili a tutto il gruppo, assegnando gli ESP ai fattori che preferisci;;
;- Statistiche, in cui potrai consultare alcuni dati, come il totale dei nemici sconfitti, la percentuale di completamento, le carte sbloccate ecc.;;
;- Galleria, per visualizzare tutti gli elementi sbloccati durante il gioco, come armi e personaggi§ - Esci, per tornare al Menu Titoli e chiudere il gioco.;;
;Ogni riga corrisponde ad un fattore diverso ed ogni casella ad un suo singolo potenziamento. Ogni potenziamento è ottenibile tramite una certa quantità di ESP.;;
;- Nrg: aumenta la tua Energia massima e resistenza in battaglia§ - Atk: incrementa la tua forza d'attacco per sferrare colpi sempre più potenti;;
;- Pwr: diversi poteri e abilità che possono apprendere tutti gli eroi del gruppo, o specifici per un singolo eroe.§ L'ultima riga è dedicata alle tue armi e relative trasformazioni. ;;
;Le tue armi, infatti, possono essere trasformate, cambiando forma e diventando più potenti. Inoltre questo sbloccherà nuovi potenziamenti nelle altre righe.;;
