en;it;es;fr
;\f[6]\nb[\n[6]]Lo stesso frammento di Cristallo di Teorhemas che mi ha portato qui nel futuro è ancora con me, \n[1]!;;
;\f[6]\nb[\n[6]]E come lo usai per andare nel futuro, ora lo userò per tornare nel passato…;;
;\f[6]\nb[\n[6]]E FARÒ QUESTO TUTTE LE VOLTE CHE SARÀ NECESSARIO, FINO A QUANDO NON TI AVRÒ DISTRUTTO!!!;;
;\f[1]\nb[\n[1]]Basta parlare \n[6]!\| Fatti avanti e finiamola una volta per tutte!;;
;\f[6]\nb[\n[6]]Volentieri!\.\^;;
;Genera nuovi robot in continuazione!;;
;Devi indebolirlo colpendolo nei suoi punti deboli!;;
;Eroi, non riuscirete mai a danneggiarlo, è troppo forte!;;
;Dobbiamo distruggerlo con i nostri poteri!;;
;Recuperate le sfere di energia che vi passiamo!;;
;Saremo così in grado di riunire i nostri poteri e distruggerlo!;;
;Nascondetevi in quella crepa nel terreno!;;
;Jer, ti ha trascinato in una distorsione spazio-temporale!;;
;Devi eliminare \n[6] al più presto!;;
;\n[1] siamo tutti con te!;;
;Muori \n[1]!;;
