en;it;es;fr
;\f[4]\nb[\n[4]]Esiste una cosa, nel Regno, arrivata all'improvviso e dalla provenienza del tutto ignota…;;
;\f[4]\nb[\n[4]]Noi la chiamiamo \map[The Great Cluster].;;
;\f[1]\nb[\n[1]]\map[The Great Cluster]?!;;
;\f[4]\nb[\n[4]]Sì, è un grande ammasso di parti e pezzi meccanici, una sorta di mezzo robot, ma che è immobile.;;
;\f[4]\nb[\n[4]]\map[The Great Cluster] è fermo, immobile, non agisce, pensa soltanto.\|§ E questo basta e avanza.;;
;\f[4]\nb[\n[4]]Pur non potendo muoversi, è circondato da diversi scagnozzi, uno dei quali è Spike, quello che avete sconfitto poco fa!;;
;\f[4]\nb[\n[4]]Partiremo e andremo da \map[The Great Cluster]. \| Prima di partire, però, vi consiglio di passare dall'altra stanza e parlare con Saggio Viola.;;
;\f[4]\nb[\n[4]]Io vi aspetterò di sopra, fuori dal rifugio.\. Mi unirò con voi e andremo insieme!;;
;\nb[Eroi]\af[5:6]Bene, a dopo!;;
;\f[5]\nb[\n[5]]Eroi, dietro di me avete i portali di teletrasporto.\| Ogni teletrasporto vi porterà nei luoghi già visitati.;;
;\f[5]\nb[\n[5]]Per sbloccare un luogo dovrete completarne il suo atto.;;
;\f[5]\nb[\n[5]]Potete tornare nei luoghi già visitati, compreso i \map[Royal Gardens].\| In questo caso tornerete indietro nel tempo, nella vostra epoca.;;
;\f[5]\nb[\n[5]]Mi raccomando, non rimaneteci troppo a lungo.\| Abbiamo bisogno di voi qui!;;
;\f[5]\nb[\n[5]]Gli atti già completati offrono delle \c[1]Missioni Extra\c[0] da completare.\| Ognuna di queste missioni potrà essere sbloccata in cambio di Diamanti.;;
;\f[5]\nb[\n[5]]I Diamanti sono oggetti preziosi che potete trovare in giro per il Regno.\| È facile trovare i Diamanti sotto terra.;;
;\f[5]\nb[\n[5]]\n[3], tu potresti essere in grado di scavare nel terreno grazie alla tua armatura metallica!;;
;\f[5]\nb[\n[5]]Guarda subito se hai gli ESP necessari per apprenderla!\| Completate queste Missioni Extra per ricevere in cambio ricompense sempre maggiori!;;
;\f[5]\nb[\n[5]]Ora sapete tutto ciò che vi occorre sapere.\|§ \n[4] vi aspetta qua fuori dal rifugio.\. Buona fortuna!;;
;\c[18]NOTA:\c[0] Per teletrasportarti da \map[The Great Cluster] utilizza il portale della \map[Abandoned Area].;;
