en;it;es;fr
\f[1]\nb[\n[1]We should be getting close to a Sage...;\f[1]\nb[\n[1]]Dovremmo ormai essere vicini ad uno dei saggi… ;;
\f[1]\nb[\n[1]]Oh, here you are at last!;\f[1]\nb[\n[1]]Oh, finalmente!\. Eccoti qui!;;
\f[7]\nb[\n[7]]You again?!\| I thought a batch of new heroes would have stepped up by now!;\f[7]\nb[\n[7]]Ancora voi?!\| Pensavo mi sarebbero venuti a salvare dei nuovi eroi!;;
\f[1]\nb[\n[1]]Quit your whining and go assist Purple Sage.\|§ We need your help to destroy \map[The Great Cluster]!;\f[1]\nb[\n[1]]Ma non rompere e vai ad aiutare Saggio Viola.\|§ Abbiamo bisogno anche del tuo aiuto per distruggere \map[The Great Cluster]!;;
\f[5]\nb[\n[5]]Congratulations, heroes, that was quite a feat!\. The Ice Sage is free, and is ready to join the attack on \map[The Great Cluster].;\f[5]\nb[\n[5]]Complimenti eroi, ve la siete cavata alla grande!\. Il saggio del ghiaccio è libero e pronto ad aiutarci con i suoi poteri per distruggere \map[The Great Cluster].;;
\f[5]\nb[\n[5]]He can't do anything on his own though, we have to find the other two Sages!;\f[5]\nb[\n[5]]Ma da solo non può fare niente, abbiamo ancora bisogno degli altri due saggi!;;
